{
  "$schema": "http://json-schema.org/draft-07/schema#",
  "$id": "https://utsu-ri.dev/schemas/report/v1",
  "title": "UtsuriReport",
  "type": "object",
  "additionalProperties": false,
  "required": [
    "schemaVersion",
    "language",
    "reportId",
    "status",
    "summary",
    "files",
    "hunks",
    "evidence",
    "unclassifiedHunkRefs",
    "changes",
    "targets",
    "comparisons",
    "findings",
    "coverage",
    "origin",
    "diagnostics"
  ],
  "properties": {
    "schemaVersion": { "const": "1.0" },
    "language": {
      "type": "string",
      "minLength": 2,
      "maxLength": 35,
      "pattern": "^[A-Za-z]{2,8}(?:-[A-Za-z0-9]{1,8})*$"
    },
    "reportId": {
      "type": "string",
      "pattern": "^report[-:][A-Za-z0-9._:-]+$",
      "maxLength": 256
    },
    "status": { "enum": ["PASS", "CHANGED", "REGRESSION", "INCOMPLETE", "UNCOVERED", "SKIPPED"] },
    "summary": {
      "type": "object",
      "additionalProperties": false,
      "required": ["statement", "filesChanged", "additions", "deletions"],
      "properties": {
        "statement": { "type": "string" },
        "filesChanged": { "type": "integer", "minimum": 0 },
        "additions": { "type": "integer", "minimum": 0 },
        "deletions": { "type": "integer", "minimum": 0 }
      }
    },
    "files": { "type": "array", "items": { "$ref": "#/$defs/file" } },
    "hunks": { "type": "array", "items": { "$ref": "#/$defs/hunk" } },
    "evidence": { "type": "array", "items": { "$ref": "#/$defs/evidence" } },
    "unclassifiedHunkRefs": { "type": "array", "items": { "type": "string" }, "uniqueItems": true },
    "changes": { "type": "array", "items": { "$ref": "#/$defs/change" } },
    "targets": { "type": "array", "items": { "$ref": "#/$defs/target" } },
    "comparisons": { "type": "array", "items": { "$ref": "#/$defs/comparison" } },
    "findings": { "type": "array", "items": { "$ref": "#/$defs/finding" } },
    "coverage": {
      "type": "object",
      "additionalProperties": false,
      "required": [
        "knownUsages",
        "verifiedUsages",
        "unknownPossible",
        "planned",
        "succeeded",
        "failed"
      ],
      "properties": {
        "knownUsages": { "type": ["integer", "null"], "minimum": 0 },
        "verifiedUsages": { "type": "integer", "minimum": 0 },
        "unknownPossible": { "type": "boolean" },
        "planned": { "type": "integer", "minimum": 0 },
        "succeeded": { "type": "integer", "minimum": 0 },
        "failed": { "type": "integer", "minimum": 0 }
      }
    },
    "origin": { "$ref": "#/$defs/origin" },
    "diagnostics": {
      "type": "object",
      "additionalProperties": false,
      "required": ["incompleteReasons", "blockedRequestCount"],
      "properties": {
        "incompleteReasons": { "type": "array", "items": { "type": "string" } },
        "blockedRequestCount": { "type": "integer", "minimum": 0 }
      }
    }
  },
  "$defs": {
    "file": {
      "type": "object",
      "additionalProperties": false,
      "required": [
        "id",
        "status",
        "oldPath",
        "newPath",
        "additions",
        "deletions",
        "binary",
        "submodule",
        "oldMode",
        "newMode",
        "oldOid",
        "newOid",
        "lowSignal",
        "lowSignalReasons",
        "hunkRefs"
      ],
      "properties": {
        "id": { "type": "string", "pattern": "^file:" },
        "status": {
          "enum": [
            "added",
            "modified",
            "deleted",
            "renamed",
            "copied",
            "type-changed",
            "unmerged",
            "unknown"
          ]
        },
        "oldPath": { "type": ["string", "null"] },
        "newPath": { "type": ["string", "null"] },
        "additions": { "type": ["integer", "null"], "minimum": 0 },
        "deletions": { "type": ["integer", "null"], "minimum": 0 },
        "binary": { "type": "boolean" },
        "submodule": { "type": "boolean" },
        "oldMode": { "type": ["string", "null"], "pattern": "^[0-7]{6}$" },
        "newMode": { "type": ["string", "null"], "pattern": "^[0-7]{6}$" },
        "oldOid": { "type": ["string", "null"], "pattern": "^[a-f0-9]{7,64}$" },
        "newOid": { "type": ["string", "null"], "pattern": "^[a-f0-9]{7,64}$" },
        "lowSignal": { "type": "boolean" },
        "lowSignalReasons": {
          "type": "array",
          "items": { "type": "string" },
          "uniqueItems": true
        },
        "hunkRefs": {
          "type": "array",
          "items": { "type": "string", "pattern": "^hunk:" },
          "uniqueItems": true
        }
      }
    },
    "line": {
      "type": "object",
      "additionalProperties": false,
      "required": ["kind", "content", "oldLine", "newLine"],
      "properties": {
        "kind": { "enum": ["context", "addition", "deletion", "no-newline"] },
        "content": { "type": "string" },
        "oldLine": { "type": ["integer", "null"], "minimum": 1 },
        "newLine": { "type": ["integer", "null"], "minimum": 1 }
      }
    },
    "hunk": {
      "type": "object",
      "additionalProperties": false,
      "required": [
        "id",
        "path",
        "oldPath",
        "newPath",
        "oldStart",
        "oldLines",
        "newStart",
        "newLines",
        "heading",
        "lines",
        "lowSignal"
      ],
      "properties": {
        "id": { "type": "string", "pattern": "^hunk:" },
        "path": { "type": "string", "minLength": 1 },
        "oldPath": { "type": ["string", "null"] },
        "newPath": { "type": ["string", "null"] },
        "oldStart": { "type": "integer", "minimum": 0 },
        "oldLines": { "type": "integer", "minimum": 0 },
        "newStart": { "type": "integer", "minimum": 0 },
        "newLines": { "type": "integer", "minimum": 0 },
        "heading": { "type": "string" },
        "lines": { "type": "array", "items": { "$ref": "#/$defs/line" } },
        "lowSignal": { "type": "boolean" }
      }
    },
    "evidence": {
      "type": "object",
      "additionalProperties": false,
      "required": ["id", "type", "path", "range", "summary", "hunkRefs"],
      "properties": {
        "id": { "type": "string", "pattern": "^evidence:" },
        "type": {
          "enum": [
            "code",
            "test",
            "style",
            "configuration",
            "generated",
            "binary",
            "visual",
            "dom",
            "aria",
            "a11y",
            "runtime"
          ]
        },
        "path": { "type": "string", "minLength": 1 },
        "range": {
          "oneOf": [
            { "type": "null" },
            {
              "type": "object",
              "additionalProperties": false,
              "required": ["start", "end"],
              "properties": {
                "start": { "type": "integer", "minimum": 0 },
                "end": { "type": "integer", "minimum": 0 }
              }
            }
          ]
        },
        "summary": { "type": "string" },
        "hunkRefs": {
          "type": "array",
          "items": { "type": "string", "pattern": "^hunk:" },
          "uniqueItems": true
        }
      }
    },
    "change": {
      "type": "object",
      "additionalProperties": false,
      "required": [
        "id",
        "title",
        "kind",
        "summary",
        "intent",
        "implementation",
        "userImpact",
        "technicalImpact",
        "risk",
        "hunkRefs",
        "targetRefs",
        "findingRefs",
        "verification"
      ],
      "properties": {
        "id": { "type": "string", "pattern": "^change[-:]" },
        "title": { "type": "string", "minLength": 1 },
        "kind": {
          "enum": ["visual", "behavior", "content", "accessibility", "refactor", "mixed", "unknown"]
        },
        "summary": { "type": "string" },
        "intent": {
          "type": "object",
          "additionalProperties": false,
          "required": ["text", "source", "evidenceRefs"],
          "properties": {
            "text": { "type": "string" },
            "source": { "enum": ["declared", "supported-inference", "weak-inference", "unknown"] },
            "evidenceRefs": { "type": "array", "items": { "type": "string" }, "uniqueItems": true },
            "missingEvidence": { "type": "array", "items": { "type": "string" } }
          }
        },
        "implementation": { "type": "string" },
        "userImpact": { "type": "array", "items": { "type": "string" } },
        "technicalImpact": { "type": "array", "items": { "type": "string" } },
        "risk": {
          "type": "object",
          "additionalProperties": false,
          "required": ["level", "reasons"],
          "properties": {
            "level": { "enum": ["critical", "high", "medium", "low", "info"] },
            "reasons": { "type": "array", "items": { "type": "string" } }
          }
        },
        "hunkRefs": { "type": "array", "items": { "type": "string" }, "uniqueItems": true },
        "targetRefs": { "type": "array", "items": { "type": "string" }, "uniqueItems": true },
        "findingRefs": { "type": "array", "items": { "type": "string" }, "uniqueItems": true },
        "verification": {
          "type": "object",
          "additionalProperties": false,
          "required": ["verified", "gaps"],
          "properties": {
            "verified": { "type": "array", "items": { "type": "string" } },
            "gaps": { "type": "array", "items": { "type": "string" } }
          }
        }
      }
    },
    "captureResult": {
      "type": "object",
      "additionalProperties": false,
      "required": ["status", "screenshotRefs"],
      "properties": {
        "status": { "enum": ["success", "failed", "skipped"] },
        "url": { "type": "string" },
        "screenshotRefs": { "type": "array", "items": { "type": "string" } },
        "domRef": { "type": "string" },
        "ariaRef": { "type": "string" },
        "styleRef": { "type": "string" },
        "axeRef": { "type": "string" },
        "consoleRef": { "type": "string" },
        "networkRef": { "type": "string" },
        "metadataRef": { "type": "string" },
        "failure": {
          "type": "object",
          "additionalProperties": false,
          "required": ["code", "message", "stage"],
          "properties": {
            "code": { "type": "string" },
            "message": { "type": "string" },
            "stage": { "type": "string" }
          }
        }
      }
    },
    "target": {
      "type": "object",
      "additionalProperties": false,
      "required": [
        "id",
        "routeOrStory",
        "viewport",
        "state",
        "roots",
        "discovery",
        "before",
        "after"
      ],
      "properties": {
        "id": { "type": "string", "pattern": "^target:" },
        "routeOrStory": { "type": "string" },
        "viewport": { "type": "string" },
        "state": { "type": "string" },
        "roots": { "type": "array", "items": { "type": "string" } },
        "discovery": {
          "type": "object",
          "additionalProperties": false,
          "required": ["source", "confidence", "reason"],
          "properties": {
            "source": {
              "enum": ["explicit", "storybook", "test", "route", "import", "selector", "fallback"]
            },
            "confidence": { "enum": ["explicit", "strong", "medium", "weak", "unknown"] },
            "reason": { "type": "string" }
          }
        },
        "before": { "$ref": "#/$defs/captureResult" },
        "after": { "$ref": "#/$defs/captureResult" },
        "comparisonRef": { "type": "string", "pattern": "^comparison:" }
      }
    },
    "comparison": {
      "type": "object",
      "additionalProperties": false,
      "required": ["id", "targetRef", "status", "images", "structural", "incompleteReasons"],
      "properties": {
        "id": { "type": "string", "pattern": "^comparison:" },
        "targetRef": { "type": "string", "pattern": "^target:" },
        "status": { "enum": ["compared", "incomplete"] },
        "images": { "type": "array", "items": { "$ref": "#/$defs/imageComparison" } },
        "structural": {
          "oneOf": [
            { "type": "null" },
            {
              "type": "object",
              "additionalProperties": false,
              "required": ["dom", "aria", "style"],
              "properties": {
                "dom": { "$ref": "#/$defs/structuralFingerprint" },
                "aria": { "$ref": "#/$defs/structuralFingerprint" },
                "style": { "$ref": "#/$defs/structuralFingerprint" }
              }
            }
          ]
        },
        "incompleteReasons": {
          "type": "array",
          "items": { "type": "string" },
          "uniqueItems": true
        }
      }
    },
    "structuralFingerprint": {
      "type": "object",
      "additionalProperties": false,
      "required": ["beforeHash", "afterHash", "changed"],
      "properties": {
        "beforeHash": { "type": "string", "pattern": "^[a-f0-9]{64}$" },
        "afterHash": { "type": "string", "pattern": "^[a-f0-9]{64}$" },
        "changed": { "type": "boolean" }
      }
    },
    "imageComparison": {
      "type": "object",
      "additionalProperties": false,
      "required": [
        "id",
        "kind",
        "label",
        "beforeRef",
        "afterRef",
        "diffRef",
        "width",
        "height",
        "diffPixelCount",
        "diffRatio",
        "regions"
      ],
      "properties": {
        "id": { "type": "string", "pattern": "^image-comparison:" },
        "kind": { "enum": ["full-page", "crop", "viewport"] },
        "label": { "type": "string", "minLength": 1 },
        "beforeRef": { "type": "string", "pattern": "^capture/" },
        "afterRef": { "type": "string", "pattern": "^capture/" },
        "diffRef": { "type": "string", "pattern": "^comparison/" },
        "width": { "type": "integer", "minimum": 1 },
        "height": { "type": "integer", "minimum": 1 },
        "diffPixelCount": { "type": "integer", "minimum": 0 },
        "diffRatio": { "type": "number", "minimum": 0, "maximum": 1 },
        "regions": { "type": "array", "items": { "$ref": "#/$defs/changedRegion" } }
      }
    },
    "changedRegion": {
      "type": "object",
      "additionalProperties": false,
      "required": ["id", "x", "y", "width", "height", "pixels"],
      "properties": {
        "id": { "type": "string", "pattern": "^region:" },
        "x": { "type": "integer", "minimum": 0 },
        "y": { "type": "integer", "minimum": 0 },
        "width": { "type": "integer", "minimum": 1 },
        "height": { "type": "integer", "minimum": 1 },
        "pixels": { "type": "integer", "minimum": 1 }
      }
    },
    "finding": {
      "type": "object",
      "additionalProperties": false,
      "required": [
        "id",
        "category",
        "state",
        "severity",
        "title",
        "description",
        "evidenceRefs",
        "hunkRefs"
      ],
      "properties": {
        "id": { "type": "string", "pattern": "^finding:" },
        "category": {
          "enum": [
            "visual",
            "layout",
            "dom",
            "aria",
            "style",
            "a11y",
            "console",
            "page-error",
            "network",
            "coverage",
            "security"
          ]
        },
        "state": { "enum": ["new", "resolved", "unchanged", "incomplete"] },
        "severity": { "enum": ["critical", "high", "medium", "low", "info"] },
        "title": { "type": "string" },
        "description": { "type": "string" },
        "targetRef": { "type": "string" },
        "evidenceRefs": { "type": "array", "items": { "type": "string" } },
        "hunkRefs": { "type": "array", "items": { "type": "string" } }
      }
    },
    "origin": {
      "type": "object",
      "additionalProperties": false,
      "required": ["host", "projectFingerprint", "reportId", "bindingMode", "createdAt"],
      "properties": {
        "host": { "enum": ["codex", "claude-code", "unknown"] },
        "sessionRef": { "type": "string", "pattern": "^session:[a-f0-9]{64}$" },
        "projectFingerprint": { "type": "string", "pattern": "^[a-f0-9]{64}$" },
        "reportId": {
          "type": "string",
          "pattern": "^report[-:][A-Za-z0-9._:-]+$",
          "maxLength": 256
        },
        "bindingMode": { "enum": ["direct-same-session", "return-to-session", "unbound"] },
        "createdAt": { "type": "string", "format": "date-time" }
      },
      "allOf": [
        {
          "if": { "properties": { "bindingMode": { "const": "unbound" } } },
          "then": { "not": { "required": ["sessionRef"] } },
          "else": {
            "required": ["sessionRef"],
            "properties": { "host": { "enum": ["codex", "claude-code"] } }
          }
        }
      ]
    }
  }
}
